{
  "activation_mode": "first_v2_activation",
  "artifact_digest": "52ae49cbf5958e6d3760a60846ab98cfaf90174ef4558f1f2441288fd83b8521",
  "authority_class": "human_governance",
  "authorization_id": "3d8e50f6-1dda-5abf-89b9-c04f2ffd6a43",
  "authorization_scope": "activate_exact_ready_v2_alias_set_only",
  "authorization_state": "authorized_for_controlled_v2_activation_only",
  "authorized": true,
  "build_manifest_digest": "fdd46786cc78aa43ca47a6aca3091374d7bd37cdf24e5791017ee0c7a1275339",
  "census_digest": "0cf872e3822494bb0fe9c4be7f0e2adb0009d3330ef96b2461a89c5192302446",
  "corpus_digest": "e086e48dda72b9bc38f6cb4d4f68a60bc5af7dfa38b47b49659fc3312a2efd9b",
  "decision_reference": "mnemo-v2-first-activation-human-authorization-2026-09-01",
  "generation_checksums": [
    "d08a748116bc106f499c4a59f1df85d86907741035be10aa5995eb2d55234335",
    "1aa2374437c72ef8f3bf23ba9cc09e65b8d6e4aa2f4d0c0b645f60a458b0f3a8",
    "3051a749bfdfe41a83e44da4ec60cd3e1df18619dee9ff3135ebd3373bfcba30",
    "3051a749bfdfe41a83e44da4ec60cd3e1df18619dee9ff3135ebd3373bfcba30"
  ],
  "generation_ids": [
    "81f673bb-665d-591a-b12b-472ff3e39b7c",
    "a7220adf-202c-536e-8e7c-c09d4d4c563f",
    "62243160-bed5-5064-a664-815984232e31",
    "2b26443e-bb99-5bf8-a4af-a01ba99af8ce"
  ],
  "generation_namespace": "full_multilingual_v2",
  "profile_fingerprint": "51eb57f1f252d4e3e771668be8a70316303ede40c97cf0d3d25f7d20ed728034",
  "recovery_mode": "deactivate_v2_alias_set",
  "run_id": "0b04f05c-a3d5-5879-b878-cd5f8e84ff2f",
  "schema_version": "mnemo.v2-activation-authorization/1",
  "storage_manifest_digest": "0f34a97fd64301d86ccbe8d15dad08bb7442ff484a4e5166d8ec0056b2220ed7",
  "target_database_path": "scratch/phase8_5_full_multilingual_v2/build-20260831-01/mnemo.db",
  "vector_space_identity": "7dcba654e1c947145253ff65ef93e2b4ef1105cdf680b79218a446c79cc1a0d7"
}
